{
  "componentPublications": [
    {
      "access": "anonymous",
      "id": "npm-sdk",
      "manifest": "package.json",
      "registry": "https://registry.npmjs.org",
      "repository": "clavenar-typescript-sdk",
      "tag": "v1.6.2",
      "version": "1.6.2"
    },
    {
      "access": "anonymous",
      "id": "python-sdk",
      "manifest": "pyproject.toml",
      "registry": "https://pypi.org",
      "repository": "clavenar-python-sdk",
      "tag": "v1.5.2",
      "version": "1.5.2"
    },
    {
      "access": "authenticated-registry-and-anonymous-release",
      "id": "maven-sdk",
      "manifest": "pom.xml",
      "registry": "https://maven.pkg.github.com/clavenar/clavenar-java-sdk",
      "repository": "clavenar-java-sdk",
      "tag": "v1.5.4",
      "version": "1.5.4"
    },
    {
      "access": "authenticated-registry-and-anonymous-release",
      "id": "nuget-sdk",
      "manifest": "src/Clavenar.AgentSdk/Clavenar.AgentSdk.csproj",
      "registry": "https://nuget.pkg.github.com/clavenar/index.json",
      "repository": "clavenar-dotnet-sdk",
      "tag": "v1.6.4",
      "version": "1.6.4"
    },
    {
      "access": "anonymous",
      "id": "go-sdk",
      "manifest": "VERSION",
      "registry": "https://proxy.golang.org",
      "repository": "clavenar-go-sdk",
      "tag": "v1.5.1",
      "version": "1.5.1"
    },
    {
      "access": "anonymous",
      "id": "rust-sdk",
      "manifest": "Cargo.toml",
      "registry": "https://github.com/clavenar/clavenar-sdk/releases",
      "repository": "clavenar-sdk",
      "tag": "v0.4.2",
      "version": "0.4.2"
    },
    {
      "access": "anonymous",
      "id": "lite",
      "manifest": "Cargo.toml",
      "registry": "https://ghcr.io/clavenar/clavenar-lite",
      "repository": "clavenar-lite",
      "tag": "v0.13.0",
      "version": "0.13.0"
    },
    {
      "access": "anonymous",
      "id": "cli",
      "manifest": "Cargo.toml",
      "registry": "https://github.com/clavenar/clavenar-ctl/releases",
      "repository": "clavenar-ctl",
      "tag": "v0.3.3",
      "version": "0.3.3"
    },
    {
      "access": "anonymous",
      "id": "helm",
      "manifest": "charts/clavenar/Chart.yaml",
      "registry": "oci://ghcr.io/clavenar/charts/clavenar",
      "repository": "clavenar-charts",
      "tag": "v0.39.2",
      "version": "0.39.2"
    }
  ],
  "contract": "clavenar.protected-distribution/v1",
  "goModuleTags": [
    "v1.5.1",
    "adapters/anthropic/v1.5.1",
    "adapters/openai/v1.5.1",
    "examples/v1.5.1"
  ],
  "imagePublication": {
    "access": "anonymous",
    "repositories": [
      "clavenar-brain",
      "clavenar-chaos-monkey",
      "clavenar-console",
      "clavenar-deep-review",
      "clavenar-demo-mint",
      "clavenar-hil",
      "clavenar-identity",
      "clavenar-ledger",
      "clavenar-policy-engine",
      "clavenar-proxy",
      "clavenar-simulator",
      "clavenar-website"
    ],
    "subjectCount": 13,
    "tagPolicy": "digest-only"
  },
  "policyVersion": "1.0.0",
  "publicationEvent": "clavenar-protected-publication",
  "requiredActor": "vanteguardlabs",
  "schemaVersion": 1,
  "stackRelease": "1.250.3"
}
